user_input,retrieved_contexts,response,reference,faithfulness,answer_relevancy,context_precision,context_recall
O que é Conhecimento Tradicional Associado?,"['A essas populações é assegurado, ainda, o uso ou a venda livre de produtos que contenham\npatrimônio genético ou conhecimento tradicional associado, além de participar do processo de\ntomada de decisão sobre assuntos relacionados ao acesso a conhecimento tradicional associado e\nà repartição de benefícios decorrente desse acesso.\nNa Figura 3 são apresentadas as formas de reconhecimento dos conhecimentos tradicionais\nassociados, segundo o novo marco regulatório (Art.', '8º, §3º):\nFigura 3 \nFormas de reconhecimento dos conhecimentos tradicionais  \nassociados, segundo o novo marco regulatório\nA norma traz uma diferenciação entre o conhecimento tradicional de origem identificável, e o\nconhecimento de origem não identificável sendo este, conforme definido na própria Lei, como\naquele em que não há a possibilidade de vincular a sua origem a, pelo menos, uma população\nindígena, comunidade tradicional ou agricultor tradicional, e por isso independe de consentimento\nprévio (Artigos 2º e 9º) (Figura 4).\nFigura 4 \nDefinições de conhecimento tradicional identificável e não identificável\n \nConhecimento de origem identificável (§ 1º, art.\n9º da Lei 13.123/15; art.', 'Já em relação ao conhecimento tradicional associado, Santilli \n(2005, p. 136) ensina que “inclui toda a informação útil à identificação de \nprincípios ativos de biomoléculas ou características funcionais de células e \nmicro-organismos, independentemente de a utilização tradicional coincidir \nou não com a utilização biotecnológica”.\nA partir da ótica dos direitos humanos aplicada aos CTA, é possí-\nvel vislumbrar as falhas intrínsecas à lei em análise, que os reduziu a mero \ninsumo para o sistema de ciência, tecnologia e inovação, amesquinhando \nsua importância.', 'Conhecimento Tradicional e Bioprospecção foram detalhadas na Medida Provisória, definindo como\nconhecimento tradicional associado a informação ou prática individual ou coletiva de comunidade\nindígena ou de comunidade local, com valor real ou potencial, associada ao patrimônio genético,\nsendo a comunidade local o grupo humano, incluindo remanescentes de comunidades de\nquilombos, distintos por suas condições culturais, que se organiza, tradicionalmente, por gerações\nsucessivas e costumes próprios, e que conserva suas instituições sociais e econômicas (Art.\n7º, II\ne III ).\nA partir de 2003, alguns Projetos de Lei versando sobre o tema foram propostos e apensados ao\nPL 4.842/98, que já tinha em apenso o PL 4.579/98.']","De acordo com o contexto, o Conhecimento Tradicional Associado (CTA) é definido como a informação ou prática individual ou coletiva de comunidade indígena ou de comunidade local, com valor real ou potencial, associada ao patrimônio genético. Além disso, também inclui toda a informação útil à identificação de princípios ativos de biomoléculas ou características funcionais de células e micro-organismos, independentemente de a utilização tradicional coincidir ou não com a utilização biotecnológica.","O Conhecimento Tradicional Associado (CTA) se refere ao conhecimento tradicional associado aos recursos genéticos da biodiversidade, ou seja, ao conhecimento desenvolvido pelos povos indígenas e comunidades tradicionais sobre o uso dos recursos naturais, incluindo plantas, animais e micro-organismos. Esse conhecimento é resultado da experiência e sabedoria acumuladas ao longo do tempo por essas comunidades em relação à biodiversidade. No contexto da Lei nº 13.123/2015, o acesso ao Conhecimento Tradicional Associado é definido como a pesquisa ou desenvolvimento tecnológico realizado sobre conhecimento tradicional associado ao patrimônio genético, que possibilite ou facilite o acesso ao patrimônio genético.",1.0,0.8897644603674145,0.8055555555287036,0.6666666666666666
Empresas de Pequeno Porte entram no CGen?,"['1.\nEmpresas de Pequeno Porte entram no CGen?\nO CGen é o Conselho de Gestão do Patrimônio Genético responsável por coordenar o assunto \nde acesso ao patrimônio genético e ao conhecimento tradicional associado.\nJá o SisGen é o \nSistema Nacional de Gestão do Patrimônio Genético e do Conhecimento Tradicional Associado, \nferramenta que deve ser utilizada por aquele que deseja cumprir a Lei 13.123/2015.\nAs empresas de pequeno porte que realizam atividades de acesso possuem obrigações perante a \nLei e devem utilizar o SisGen.\nPara saber mais sobre quando e como realizar o cadastro, consultar itens 36, 45, 46 e 48 do \nGuia Orientativo da ABIHPEC.\n2.\nEmpresas de Pequeno Porte devem se cadastrar?', '40.\nA utilização do apelo mercadológico no produto acabado muda o fato de nos enquadrarmos \nisentos na repartição de benefícios por sermos empresa de pequeno porte (EPP)?\nNão, uma empresa de pequeno porte não reparte benefícios ainda que explore o apelo \nmercadológico ou que a espécie determine as características funcionais do produto.\nPor outro \nlado, a isenção da repartição ou a inexistência de apelo ou características não desobriga a \nnotificação no SisGen.\nA Notificação independe da obrigação de repartir benefícios.\nMais informações consultar item nº 4 do Guia Orientativo da ABIHPEC.\n41.\nO termo de compromisso serve para informarmos para o órgão que estamos cientes que \ndevemos nos regularizar até Novembro/2018?', 'Empresas de Pequeno Porte devem se cadastrar?\nSim, o cadastro realizado perante ao SisGen deve ser realizado por qualquer pessoa física ou \njurídica que realize acesso ao patrimônio genético ou conhecimento tradicional associado, \nindependentemente do porte da empresa.\nPara saber mais sobre quando e como realizar o cadastro, consultar itens 36, 45, 46 e 48 do \nGuia Orientativo da ABIHPEC.\n3.\nEmpresas de Pequeno Porte devem realizar a repartição de benefícios?\nNão, de acordo com o art.\n17, §5º, inciso I da Lei 13.123/2015 e art.\n54, inciso II, do Decreto nº \n8772, as microempresas e empresas de pequeno porte estão isentas da repartição de benefícios.\nPor outro lado, não estão isentas de outras obrigações, como cadastrar e notificar.', '17.\nPara uma empresa terceirista, quando o detentor da marca ele que compra todo o insumo, \nembalagem, material, etc., e nós terceirista somente envasamos o produto de quem é a \nresponsabilidade em realizar o cadastro no CGen?\nTemos dois casos na empresa \nBENEFICIAMENTO X FULL SERVICE: FULL SERVICE - nós que compramos os insumos; e \nBENEFICIAMENTO - o cliente que compra tudo e nos envia para somente envasarmos o PA.\nO cadastro deve ser efetuado por quem realiza acesso (pesquisa e desenvolvimento tecnológico) \nindependente se tal acesso deu origem a um produto intermediário ou acabado, ou até mesmo \napenas uma patente.\nA lei define que obrigatoriamente o fabricante do produto acabado deverá notificar o produto \nacabado e, quando aplicável (vide exceções), repartir benefícios.']","Sim, empresas de pequeno porte que realizam atividades de acesso ao patrimônio genético e ao conhecimento tradicional associado devem utilizar o SisGen e, portanto, entrar no CGen. Além disso, elas também possuem obrigações perante a Lei 13.123/2015 e devem se cadastrar no SisGen.","O CGen é o Conselho de Gestão do Patrimônio Genético responsável por coordenar o assunto de acesso ao patrimônio genético e ao conhecimento tradicional associado. Já o SisGen é o Sistema Nacional de Gestão do Patrimônio Genético e do Conhecimento Tradicional Associado, ferramenta que deve ser utilizada por aquele que deseja cumprir a Lei 13.123/2015. As empresas de pequeno porte que realizam atividades de acesso possuem obrigações perante a Lei e devem utilizar o SisGen. Para saber mais sobre quando e como realizar o cadastro, consultar itens 36, 45, 46 e 48 do Guia Orientativo da ABIHPEC.",0.75,0.8875474057777394,0.999999999975,1.0
Empresas de Pequeno Porte devem se cadastrar?,"['Empresas de Pequeno Porte devem se cadastrar?\nSim, o cadastro realizado perante ao SisGen deve ser realizado por qualquer pessoa física ou \njurídica que realize acesso ao patrimônio genético ou conhecimento tradicional associado, \nindependentemente do porte da empresa.\nPara saber mais sobre quando e como realizar o cadastro, consultar itens 36, 45, 46 e 48 do \nGuia Orientativo da ABIHPEC.\n3.\nEmpresas de Pequeno Porte devem realizar a repartição de benefícios?\nNão, de acordo com o art.\n17, §5º, inciso I da Lei 13.123/2015 e art.\n54, inciso II, do Decreto nº \n8772, as microempresas e empresas de pequeno porte estão isentas da repartição de benefícios.\nPor outro lado, não estão isentas de outras obrigações, como cadastrar e notificar.', '1.\nEmpresas de Pequeno Porte entram no CGen?\nO CGen é o Conselho de Gestão do Patrimônio Genético responsável por coordenar o assunto \nde acesso ao patrimônio genético e ao conhecimento tradicional associado.\nJá o SisGen é o \nSistema Nacional de Gestão do Patrimônio Genético e do Conhecimento Tradicional Associado, \nferramenta que deve ser utilizada por aquele que deseja cumprir a Lei 13.123/2015.\nAs empresas de pequeno porte que realizam atividades de acesso possuem obrigações perante a \nLei e devem utilizar o SisGen.\nPara saber mais sobre quando e como realizar o cadastro, consultar itens 36, 45, 46 e 48 do \nGuia Orientativo da ABIHPEC.\n2.\nEmpresas de Pequeno Porte devem se cadastrar?', '40.\nA utilização do apelo mercadológico no produto acabado muda o fato de nos enquadrarmos \nisentos na repartição de benefícios por sermos empresa de pequeno porte (EPP)?\nNão, uma empresa de pequeno porte não reparte benefícios ainda que explore o apelo \nmercadológico ou que a espécie determine as características funcionais do produto.\nPor outro \nlado, a isenção da repartição ou a inexistência de apelo ou características não desobriga a \nnotificação no SisGen.\nA Notificação independe da obrigação de repartir benefícios.\nMais informações consultar item nº 4 do Guia Orientativo da ABIHPEC.\n41.\nO termo de compromisso serve para informarmos para o órgão que estamos cientes que \ndevemos nos regularizar até Novembro/2018?', 'Somos Microempresa, é necessário fazer a regularização?\nSim, qualquer pessoa natural ou jurídica que tenha desenvolvido atividade em desacordo com a \nlegislação em vigor entre 30 de junho de 2000 e 16 de novembro de 2015 deve regularizar-se de \nacordo com a Lei da Biodiversidade, independente do porte da empresa.\nA Microempresa está isenta apenas da obrigação de repartir benefícios.\nMais informações consultar item nº 57 do Guia Orientativo da ABIHPEC.']","Sim, o cadastro realizado perante ao SisGen deve ser realizado por qualquer pessoa física ou jurídica que realize acesso ao patrimônio genético ou conhecimento tradicional associado, independentemente do porte da empresa.","Sim, o cadastro realizado perante ao SisGen deve ser realizado por qualquer pessoa física ou jurídica que realize acesso ao patrimônio genético ou conhecimento tradicional associado, independentemente do porte da empresa. Para saber mais sobre quando e como realizar o cadastro, consultar itens 36, 45, 46 e 48 do Guia Orientativo da ABIHPEC.",0.8,0.8767104628874782,0.999999999975,1.0
Empresas de Pequeno Porte devem realizar a repartição de benefícios?,"['Empresas de Pequeno Porte devem se cadastrar?\nSim, o cadastro realizado perante ao SisGen deve ser realizado por qualquer pessoa física ou \njurídica que realize acesso ao patrimônio genético ou conhecimento tradicional associado, \nindependentemente do porte da empresa.\nPara saber mais sobre quando e como realizar o cadastro, consultar itens 36, 45, 46 e 48 do \nGuia Orientativo da ABIHPEC.\n3.\nEmpresas de Pequeno Porte devem realizar a repartição de benefícios?\nNão, de acordo com o art.\n17, §5º, inciso I da Lei 13.123/2015 e art.\n54, inciso II, do Decreto nº \n8772, as microempresas e empresas de pequeno porte estão isentas da repartição de benefícios.\nPor outro lado, não estão isentas de outras obrigações, como cadastrar e notificar.', 'Somos Microempresa, é necessário fazer a regularização?\nSim, qualquer pessoa natural ou jurídica que tenha desenvolvido atividade em desacordo com a \nlegislação em vigor entre 30 de junho de 2000 e 16 de novembro de 2015 deve regularizar-se de \nacordo com a Lei da Biodiversidade, independente do porte da empresa.\nA Microempresa está isenta apenas da obrigação de repartir benefícios.\nMais informações consultar item nº 57 do Guia Orientativo da ABIHPEC.', '40.\nA utilização do apelo mercadológico no produto acabado muda o fato de nos enquadrarmos \nisentos na repartição de benefícios por sermos empresa de pequeno porte (EPP)?\nNão, uma empresa de pequeno porte não reparte benefícios ainda que explore o apelo \nmercadológico ou que a espécie determine as características funcionais do produto.\nPor outro \nlado, a isenção da repartição ou a inexistência de apelo ou características não desobriga a \nnotificação no SisGen.\nA Notificação independe da obrigação de repartir benefícios.\nMais informações consultar item nº 4 do Guia Orientativo da ABIHPEC.\n41.\nO termo de compromisso serve para informarmos para o órgão que estamos cientes que \ndevemos nos regularizar até Novembro/2018?', '46.\nPreciso repartir benefícios retroativo por usar no passado produto acabado que teve acesso \nao patrimônio?\nO retroativo seria de 5 anos se houve comercialização do mesmo?\nSe este produto foi desenvolvido após 30 de junho de 2000 a empresa deverá: (i) assinar o \ntermo de compromisso junto ao MMA; (ii) cadastrar a pesquisa e notificar o produto no Sisgen; \ne (iv) repartir benefícios de acordo com as regras da nova Lei pelo período de 5 anos retroativos \ne enquanto houver comercialização do produto.\nIsso significa que, se a empresa se encaixar nas \nregras de isenção da repartição de benefícios, poderá se valer desse benefício também para a \nregularização.\nMais informações no item 60. e 61. do Guia Orientativo da ABIHPEC.\n47.']","Não, de acordo com o art. 17, §5º, inciso I da Lei 13.123/2015 e art. 54, inciso II, do Decreto nº 8772, as microempresas e empresas de pequeno porte estão isentas da repartição de benefícios.","Não, de acordo com o art. 17, §5o, inciso I da Lei 13.123/2015 e art. 54, inciso II, do Decreto no 8772, as microempresas e empresas de pequeno porte estão isentas da repartição de benefícios. Por outro lado, não estão isentas de outras obrigações, como cadastrar e notificar. Mais informações consultar item no 36 e 48 do Guia Orientativo da ABIHPEC.",1.0,0.9223743146970831,0.999999999975,0.6666666666666666
Onde posso encontrar a lista de insumos?,"['Por outro lado, não estão isentas de outras obrigações, como cadastrar e notificar.\nMais informações consultar item nº 36 e 48 do Guia Orientativo da ABIHPEC.\n4.\nOnde posso encontrar a lista de insumos?\nNão existe uma lista de espécies consideradas patrimônio genético brasileiro nem mesmo de \nmatérias-primas oriundas da biodiversidade brasileira.\nNão existe a pretensão de se criar uma \numa lista oficial.\nO Ministério da Agricultura, Pecuária e Abastecimento (MAPA) criou duas listas que indicam \nas espécies exóticas que adquiriram ou não características distintivas próprias no Brasil, \ncontudo não são extensas e legalmente podem ser revistas a qualquer hora, tendo já sido \nquestionadas por alguns setores, portanto, não trazem a segurança jurídica necessária.', 'Não existe a pretensão de se criar uma \numa lista oficial.\nA ABIHPEC não tem uma lista como esta pois não possui corpo técnico e consultivo para \nanalisar e dar pareceres sobre o centro de origem das espécies.\nPara classificação como \nbiodiversidade brasileira é necessário um estudo de classificação das áreas de distribuição e \nocorrência da espécie.\nIsso deve ser solicitado a um especialista.\nCom relação a lista de matérias-primas também não é responsabilidade da ABIHPEC pois \nexistem inúmeras empresas intermediárias no Brasil e no exterior e nem todas são associadas \nda ABIHPEC.\nMais informações consultar o item nº 12 do Guia Informativo da ABIHPEC.\n8.\nQuais são as matérias primas consideradas da Lei da Biodiversidade Brasileira que precisa \nregularizar por usar em seus produtos?', 'Esses produtos possuem extratos, manteigas, óleos como por exemplo: Castanha do Pará, Muru \nMuru, etc... \nNossa Empresa que compra os insumos para fabricar.\na) Com relação ao SISGEN como fica?\nÉ responsabilidade de quem realiza a pesquisa e o desenvolvimento tecnológico de novos \nprodutos oriundo de acesso ao patrimônio genético do país a realização do cadastro desta \npesquisa e posteriormente a notificação do produto acabado no SisGen, ainda que a \ncomercialização desses produtos ocorram exclusivamente fora do país.\nMais informações no item nº 02 e 04  do Guia Orientativo da ABIHPEC.\nb) Se a matéria-prima foi acessada antes do ano 2000: \n- \nO fornecedor precisa cadastrar a pesquisa e o desenvolvimento?', '6.\nExiste ou será criado algum grupo de trabalho sobre este tema?\nA ABIHPEC conduz internamente o tema através de reuniões periódicas conduzidas no âmbito \ndo Grupo de Trabalho de Biodiversidade, e externamente na qualidade de representante do \nsetor empresarial no CGen em conjunto com a CNI, ABBI, ABIFINA e ABIQUIM.\n7.\nExiste um banco de dados na ABIHPEC, com informações de matérias primas que \nindiscutivelmente são da biodiversidade brasileira?\nNão existe uma lista de espécies consideradas patrimônio genético brasileiro nem mesmo de \nmatérias-primas oriundas da biodiversidade brasileira.\nNão existe a pretensão de se criar uma \numa lista oficial.']","Não existe uma lista de espécies consideradas patrimônio genético brasileiro nem mesmo de matérias-primas oriundas da biodiversidade brasileira. Além disso, não existe a pretensão de se criar uma lista oficial. O Ministério da Agricultura, Pecuária e Abastecimento (MAPA) criou duas listas que indicam as espécies exóticas que adquiriram ou não características distintivas próprias no Brasil, contudo não são extensas e legalmente podem ser revistas a qualquer hora, tendo já sido questionadas por alguns setores, portanto, não trazem a segurança jurídica necessária.","Não existe uma lista de espécies consideradas patrimônio genético brasileiro nem mesmo de matérias-primas oriundas da biodiversidade brasileira. Não existe a pretensão de se criar uma uma lista oficial. O Ministério da Agricultura, Pecuária e Abastecimento (MAPA) criou duas listas que indicam as espécies exóticas que adquiriram ou não características distintivas próprias no Brasil, contudo não são extensas e legalmente podem ser revistas a qualquer hora, tendo já sido questionadas por alguns setores, portanto, não trazem a segurança jurídica necessária. Para classificação como biodiversidade brasileira é necessário um estudo de classificação das áreas de distribuição e ocorrência da espécie. Mais informações consultar o item no 12 do Guia Informativo da ABIHPEC.",1.0,0.0,0.9166666666361111,1.0
